{
  "model_name": "mistral",
  "ollama_base_url": "http://localhost:11434",
  "request_timeout_seconds": 30,
  "ollama_stream": false,
  "ollama_generate_path": "/api/generate",
  "emotion_model_kind": "heuristic",
  "telemetry_path": "logs/pipeline-telemetry.jsonl",
  "max_factual_items": 32,
  "max_emotional_items": 64
}
